{
  "algorithm_version": "0.1.0",
  "backend": "plaintext",
  "depth_budget": {
    "consumed": 6,
    "declared": 6
  },
  "input_commitments": [],
  "issued_at": "2026-10-28T08:57:22.337555+00:00",
  "issuer": "vector-issuer-010",
  "parameter_set": {
    "backend": "plaintext",
    "backend_version": "",
    "coeff_mod_bit_sizes": [],
    "library_version": "0.1.0",
    "multiplicative_depth": 6,
    "poly_modulus_degree": 0,
    "scaling_factor_bits": 0,
    "security_bits": 128
  },
  "parameter_set_hash": "c1262015326d48cee3ffb27e5083cb8da9587247afc81c48848d91b23722776d",
  "primitive": "drift",
  "receipt": {
    "key_id": "vec010-key-1",
    "public_key_pem": "-----BEGIN PUBLIC KEY-----\nMCowBQYDK2VwAyEAwYndnnrv3XSzOJrh+uxhHPeG9lUFz/tqJ3VcveREaIY=\n-----END PUBLIC KEY-----\n",
    "sha256": "aac52d441327bd3bb1a15a0009706577241365ff4f3b53d8a192989472c4f27b",
    "signature_alg": "Ed25519",
    "signature_b64": "NJOVZcFHW9m+TqRkQA51o9URYVBdTG3bFUvNu8antQERTkC1LsYMUIfI/rUJ/mq+iZZY4FIeFs4UbWBEsaZwDA=="
  },
  "regulations": [
    "EU_AI_ACT_ART15",
    "FDA_SAMD_PCCP",
    "BASEL_III"
  ],
  "result": {
    "distance": 0.0024999999999999988,
    "drift_bit": false,
    "w1_distance": 0.04999999999999999
  },
  "schema": "regaudit-fhe.report.v1",
  "schema_version": "regaudit-fhe.report.v1",
  "timestamp": {
    "issued_at": "2026-10-28T08:57:22.337619+00:00",
    "issuer": "synthetic-tsa",
    "token_b64": "qsUtRBMnvTuxoVoACXBldyQTZf9PO1PYoZKYlHLE8ns="
  }
}
