{
  "algorithm_version": "0.1.0",
  "backend": "plaintext",
  "depth_budget": {
    "consumed": 6,
    "declared": 6
  },
  "input_commitments": [
    {
      "name": "p",
      "sha256": "cbc5c4264f2784d99589328bb6b25f1ee4e83283634f6d0ec595d28c29f36159"
    },
    {
      "name": "q",
      "sha256": "85500748c42e1b1b5e9db1c1ba5d2656c62c54b05187058571aa162b33205cd3"
    }
  ],
  "issued_at": "2026-10-28T08:57:22.337289+00:00",
  "issuer": "vector-issuer-010",
  "parameter_set": {
    "backend": "plaintext",
    "backend_version": "",
    "coeff_mod_bit_sizes": [],
    "library_version": "0.1.0",
    "multiplicative_depth": 6,
    "poly_modulus_degree": 0,
    "scaling_factor_bits": 0,
    "security_bits": 128
  },
  "parameter_set_hash": "c1262015326d48cee3ffb27e5083cb8da9587247afc81c48848d91b23722776d",
  "primitive": "drift",
  "receipt": {
    "key_id": "vec010-key-1",
    "public_key_pem": "-----BEGIN PUBLIC KEY-----\nMCowBQYDK2VwAyEAwYndnnrv3XSzOJrh+uxhHPeG9lUFz/tqJ3VcveREaIY=\n-----END PUBLIC KEY-----\n",
    "sha256": "646258ab0460c2287e9a99e65be1e066d6819179bca7990d706a17e51cf340ff",
    "signature_alg": "Ed25519",
    "signature_b64": "XHzMJLK4Rmd15W8QyYfsAAWfaMbGF1a/nsG55GeOmZ6t3zSangsBw4zQ3KO7MGrAU+X67ObmdCyZU7m+MfdwCw=="
  },
  "regulations": [
    "EU_AI_ACT_ART_15"
  ],
  "result": {
    "distance": 0.0024999999999999988,
    "drift_bit": false,
    "w1_distance": 0.04999999999999999
  },
  "schema": "regaudit-fhe.report.v1",
  "schema_version": "regaudit-fhe.report.v1"
}
