{
  "algorithm_version": "0.1.0",
  "backend": "plaintext",
  "depth_budget": {
    "consumed": 6,
    "declared": 6
  },
  "input_commitments": [],
  "issued_at": "2026-10-28T08:57:22.336306+00:00",
  "issuer": "vector-issuer-010",
  "parameter_set": {
    "backend": "plaintext",
    "backend_version": "",
    "coeff_mod_bit_sizes": [],
    "library_version": "0.1.0",
    "multiplicative_depth": 6,
    "poly_modulus_degree": 0,
    "scaling_factor_bits": 0,
    "security_bits": 128
  },
  "parameter_set_hash": "c1262015326d48cee3ffb27e5083cb8da9587247afc81c48848d91b23722776d",
  "primitive": "provenance",
  "receipt": {
    "key_id": "vec010-key-1",
    "public_key_pem": "-----BEGIN PUBLIC KEY-----\nMCowBQYDK2VwAyEAwYndnnrv3XSzOJrh+uxhHPeG9lUFz/tqJ3VcveREaIY=\n-----END PUBLIC KEY-----\n",
    "sha256": "1abde950cd570fd05db4f6e647cc501e270d780e0fa90dc50a589ffd5925c9ec",
    "signature_alg": "Ed25519",
    "signature_b64": "HSz0gDbTRs1R1faXg8FjmawhLX0HyaN2+HUBC/Ox3NvKU+QPJC0J5bFZ9OsNGIDUaTMNSYb8S7B6KUTeOX/ACg=="
  },
  "regulations": [
    "EU_AI_ACT_ART10",
    "21_CFR_PART_11",
    "GDPR_ART22",
    "HIPAA"
  ],
  "result": {
    "bucket_aggregates": [
      0.0,
      0.5,
      1.3,
      0.6000000000000001
    ],
    "topk_indicator": [
      0.0,
      0.0,
      1.0,
      1.0
    ],
    "topk_indices": [
      2,
      3
    ]
  },
  "schema": "regaudit-fhe.report.v1",
  "schema_version": "regaudit-fhe.report.v1"
}
