{
  "algorithm_version": "0.1.0",
  "backend": "plaintext",
  "depth_budget": {
    "consumed": 6,
    "declared": 6
  },
  "input_commitments": [],
  "issued_at": "2026-10-28T08:57:22.335488+00:00",
  "issuer": "vector-issuer-010",
  "parameter_set": {
    "backend": "plaintext",
    "backend_version": "",
    "coeff_mod_bit_sizes": [],
    "library_version": "0.1.0",
    "multiplicative_depth": 6,
    "poly_modulus_degree": 0,
    "scaling_factor_bits": 0,
    "security_bits": 128
  },
  "parameter_set_hash": "c1262015326d48cee3ffb27e5083cb8da9587247afc81c48848d91b23722776d",
  "primitive": "fairness",
  "receipt": {
    "key_id": "vec010-key-1",
    "public_key_pem": "-----BEGIN PUBLIC KEY-----\nMCowBQYDK2VwAyEAwYndnnrv3XSzOJrh+uxhHPeG9lUFz/tqJ3VcveREaIY=\n-----END PUBLIC KEY-----\n",
    "sha256": "d82ff5ba64e731f0df18a21726da6b5728fe5a53d19033befb63d4ac41deb5a2",
    "signature_alg": "Ed25519",
    "signature_b64": "NRvB+q875t+5a63JvnXEHxNadzEfV95H6kiPZo2YP62MX4Gi98Qlj5KR7LvbpJtXFL7Q1xMlk8Ko9xZ2iad9Bw=="
  },
  "regulations": [
    "NYC_LL144",
    "EU_AI_ACT_ART10",
    "EU_AI_ACT_ART15",
    "COLORADO_AI_ACT",
    "CFPB_ALG_DISCRIM"
  ],
  "result": {
    "demographic_parity_diff": -0.2545454545454546,
    "equal_opportunity_diff": -0.5,
    "predictive_parity_diff": -0.2,
    "threshold_breached": true
  },
  "schema": "regaudit-fhe.report.v1",
  "schema_version": "regaudit-fhe.report.v1"
}
