{
  "algorithm_version": "0.1.0",
  "backend": "plaintext",
  "depth_budget": {
    "consumed": 6,
    "declared": 6
  },
  "input_commitments": [],
  "issued_at": "2026-10-28T08:57:22.336925+00:00",
  "issuer": "vector-issuer-010",
  "parameter_set": {
    "backend": "plaintext",
    "backend_version": "",
    "coeff_mod_bit_sizes": [],
    "library_version": "0.1.0",
    "multiplicative_depth": 6,
    "poly_modulus_degree": 0,
    "scaling_factor_bits": 0,
    "security_bits": 128
  },
  "parameter_set_hash": "c1262015326d48cee3ffb27e5083cb8da9587247afc81c48848d91b23722776d",
  "primitive": "drift",
  "receipt": {
    "key_id": "vec010-key-1",
    "public_key_pem": "-----BEGIN PUBLIC KEY-----\nMCowBQYDK2VwAyEAwYndnnrv3XSzOJrh+uxhHPeG9lUFz/tqJ3VcveREaIY=\n-----END PUBLIC KEY-----\n",
    "sha256": "17586ca9da05bfe91b6245f5f93172600f2672522904239f4daf13232135d59d",
    "signature_alg": "Ed25519",
    "signature_b64": "s1a6KYNf7X1KKElyP5oQstGhUAsjhSH5M4/kFXOVt2f2i7cI/NrkzGKBcy+w+4LlEthgxBAWPxpaahzdIyJDAA=="
  },
  "regulations": [
    "EU_AI_ACT_ART15",
    "FDA_SAMD_PCCP",
    "BASEL_III"
  ],
  "result": {
    "distance": 0.0024999999999999988,
    "drift_bit": false,
    "w1_distance": 0.04999999999999999
  },
  "schema": "regaudit-fhe.report.v1",
  "schema_version": "regaudit-fhe.report.v1"
}
