{
  "algorithm_version": "0.1.0",
  "backend": "plaintext",
  "depth_budget": {
    "consumed": 6,
    "declared": 6
  },
  "input_commitments": [],
  "issued_at": "2026-10-28T08:57:22.336749+00:00",
  "issuer": "vector-issuer-010",
  "parameter_set": {
    "backend": "plaintext",
    "backend_version": "",
    "coeff_mod_bit_sizes": [],
    "library_version": "0.1.0",
    "multiplicative_depth": 6,
    "poly_modulus_degree": 0,
    "scaling_factor_bits": 0,
    "security_bits": 128
  },
  "parameter_set_hash": "c1262015326d48cee3ffb27e5083cb8da9587247afc81c48848d91b23722776d",
  "primitive": "calibration",
  "receipt": {
    "key_id": "vec010-key-1",
    "public_key_pem": "-----BEGIN PUBLIC KEY-----\nMCowBQYDK2VwAyEAwYndnnrv3XSzOJrh+uxhHPeG9lUFz/tqJ3VcveREaIY=\n-----END PUBLIC KEY-----\n",
    "sha256": "f3ac55007b4e240a1a8d875107e5a774f18fa8704d326debaaf57cf8b840fb58",
    "signature_alg": "Ed25519",
    "signature_b64": "O61Qlim9M30I0QsyXMOh8lT9V16KpBCkpUDNOpQ8RWmimT3CJ6WzXuAUWq1ANBRanDIVf82rYXLh1mnU9PCNCQ=="
  },
  "regulations": [
    "FDA_SAMD_UQ",
    "EU_AI_ACT_ART15",
    "ISO_IEC_23053",
    "UNECE_WP29"
  ],
  "result": {
    "membership": [
      1.0,
      1.0,
      1.0
    ],
    "set_size": 3
  },
  "schema": "regaudit-fhe.report.v1",
  "schema_version": "regaudit-fhe.report.v1"
}
